BOAMP_AVIS_NUM,D_18_01_Annexed1_Infructueuxouverte,D_18_02_Annexed1_Infructueuxrestreinte,D_18_03_Annexed1_Recherche,D_18_04_Annexed1_Raisonstechniques,D_18_05_Annexed1_Raisonsartistiques,D_18_06_Annexed1_Proprieteintellectuelle,D_18_07_Annexed1_Urgenceimperieuse,D_18_08_Annexed1_Marchecomplementaire,D_18_09_Annexed1_Prestationsidentiques,D_18_10_Annexed1_Laureatsconcours,D_18_11_Annexed1_Matierespremieres,D_18_12_Annexed1_Cessationactivite,D_18_13_Annexed1_Liquidateurs,D_18_14_Annexed1_Horsscope,D_18_15_Annexed1_Explication
16-120990,False,False,False,True,False,False,False,,False,False,,,,False,"Réalisation d'un retour arrière suite à la résiliation d'un marché conclu avec un autre opérateur.Conclusion du marché public avec l'opérateur cédant, toujours titulaires des lignes non transférées vers l'opérateur résilié."
16-121060,False,False,False,False,False,True,False,,False,False,,,,False,"La société ELITECH atteste par certificat d'exclusivité être le distributeur exclusif pour la France des matériels fabriqués par la société LABITECH : Aggrégomètre APACT 4004, APACT LPC SOFTWARE, ses accessoires et ses consommablesA ce titre, cette société  est la seule habilitée à effectuer les opérations de maintenance, révisions et réparations sur ces matériels ; Aucune autre société na été habilitée et formée pour les opérations de maintenance, révisions et réparations sur ces matériels. Aucune autre société ne détient de licence pour pouvoir effectuer les mises à jour des logiciels propres à ces matériels, sil y a lieu ; Cette société est seule à pouvoir fournir les pièces détachées, accessoires et consommables dorigine nécessaires au fonctionnement et à lutilisation de ces matériels ;"
16-121103,False,False,False,False,False,True,False,,False,False,,,,False,"Cette procédure est justifiée par l'exclusivité de commercialisation des pièces détenue par la société Eurovoirie, distributeur exclusif du groupe BUCHER MUNICIPAL, constructeur de ces matériels."
16-121736,False,False,False,False,False,True,False,,False,False,,,,False,"Seule, la société GFI, détentrice des codes et sources des progiciels ASTRE GF et ASTRE RH, peut proposer la maintenance des progiciels ainsi que l'acquisition de nouveaux modules et prestations associées. De plus, au vu des délais réglementaires pour prise en compte obligatoire de la dématérialisation, il n'était pas opportun de changer nos solutions de gestion financière et gestion ressources humaines tant au niveau de la charge financière qu'au niveau de la charge ressources humaines."
16-121737,True,False,False,False,False,False,False,,False,False,,,,False,Marché négocié sans mise en concurrence suite à un lot infructueux lors du précédent appel d'offre.
16-121753,True,False,False,False,False,False,False,,False,False,,,,False,"Procédure négociée sans mise en concurrence, suite à un lot infructueux lors d'un appel d'offres."
16-121800,False,False,False,False,False,True,False,,False,False,,,,False,"Protection de droits exclusifs, y compris des droits de propriété intellectuelle "
16-121881,True,False,False,False,False,False,False,,False,False,,,,False,"Après examen des documents d'offre fournis lors d'une précédente procédure ouverte, les offres des entreprises ont toutes été déclarées inacceptables pour la raison suivante : les crédits budgétaires alloués au marché après évaluation du besoin à satisfaire ne permettaient pas au pouvoir adjudicateur de financer l'offre d'une entreprise. Dès lors, le marché a été déclaré infructueux conformément à l'article 59-III du Code des Marchés Publics, et relancé sous la forme d'un marché négocié sur le fondement de l'article 35-I-1° alinéa 3 du Code des Marchés Publics."
16-122044,False,False,False,False,False,True,False,,False,False,,,,False,"Le marché public ne peut être confié qu'à cette société, qui est la seule à pouvoir maintenir ce type d'équipements"
16-122145,False,False,False,False,False,False,False,,False,False,,,,True,"Les offres de la procédure initiale qui ne contenaient pas toutes les informations demandées ne répondaient pas entièrement aux besoins et exigences du Pouvoir Adjudicateur. Les offres ont été jugées irrégulières car incomplètes, conformément à l'article 4.2 du règlement de la consultation et au sens de l'article 24 du décret no2005-1742 du 30 décembre 2005 fixant les règles applicables aux marchés passés par les pouvoirs adjudicateurs mentionnés à l'article 3 de l'ordonnance no2005-649 du 5 juin 2005 relatives aux marchés passés par certaines personnes publiques ou privées non soumises au code des marchés publics."
16-122161,False,False,False,False,False,False,False,,False,False,,,,True,"Après l'analyse des offres de la procédure d'appel d'offres initiales, ces dernières ont été jugées inacceptables au sens de l'article 35-I-1° du code des marchés publics.Il apparaissait que les crédits budgétaires alloués au marché après estimation du besoin à satisfaire ne permettraient pas de le financer au prix fourni par les société.Il a donc été décidé de déclarer la procédure initiale infructueuse et de relancer le marché sous forme de marché négocié sans mise en concurrence."
16-122168,False,False,False,False,False,False,False,,False,False,,,,True,Le marché est un marché passé en procédure adaptée inférieur au seuil des procédures devant être publiées au JOUE
16-122186,False,False,False,False,False,True,False,,False,False,,,,False,La société Toad est diffuseur et distributeur exclusif des marques concernées pour l'ensemble du territoire français
16-122222,True,False,False,False,False,False,False,,False,False,,,,False,Le marché a été déclaré infructueux lors de l'appel d'offre ouvert car les deux offres reçues étaient incomplètes et donc irrégulières.
16-122826,True,False,False,False,False,False,False,,False,False,,,,False,La consultation a été relancée en procédure négociée avec les deux candidats ayant déposé une offre inappropriée lors de la première consultation en appel d'offres
16-122882,True,False,False,False,False,False,False,,False,False,,,,False,Plusieurs procédures ouvertes menées sans résultat.
16-122889,False,False,False,False,False,False,False,,True,False,,,,False,"Le marché initial sur lequel le recours à cette procédure est fondé est la réalisation de travaux de menuiserie MH dans le cadre de laménagement de laccueil des visiteurs individuels dans le pavillon Dufour et la Vieille Aile au château de Versailles. Les conditions nécessaires à la mise en uvre de la procédure négociée définie à larticle 35 II 6° du code des marchés publics (2006) sont réunies : le marché initial mentionne la possibilité de recourir à cette procédure ; le marché initial a été précédé dune mise en concurrence : appel doffres restreint en application des articles 33, 60 à 64 du code des marchés publics (2006) ; le présent marché est conclu dans le délai de trois ans à compter de la notification du marché initial : marché initial notifié le 05/11/2014 ; le présent marché est conclu avec le titulaire du marché initial : ASSELIN ; le cahier des clauses techniques particulières (C.C.T.P.) relatif au marché initial est repris dans son intégralité."
16-122933,False,False,False,False,False,True,False,,False,False,,,,False,"Le marché public ne peut être confié qu'à cette société, qui est la seule à pouvoir maintenir ce type de dispositifs médicaux."
16-123200,False,False,False,False,True,False,False,,False,False,,,,False,Le marché a été passé conformément à l'article 32.2.b.i de la directive 2014/24/UE du 26 février 2014 et n'est donc pas soumis à publication préalable au JOUE.
16-123219,False,False,False,False,False,True,False,,False,False,,,,False,Les prestations sont soumises à un droit d'exclusivité.
16-123301,False,False,False,False,False,False,False,,False,False,,,,True,"au terme de l'article 4 de la directive 2014/24/UE, le présent marché de services sociaux et autres services spécifiques d'un montant inférieur à 750 000 euro HT passé en procédure adaptée, il n'entre pas dans le champ de la directive 2014/24/UE."
16-123323,False,False,False,False,False,True,True,,False,False,,,,False,Les services ne peuvent être confiés qu'à un soumissionnaire déterminé pour des raisons : liées à la protection de droits d'exclusivité
16-123489,True,False,False,False,False,False,False,,False,False,,,,False,"le RPA a déclaré infructueux le lot 2 ""Fourniture et livraison d'accessoires et pièces détachées d'origine pour PL, véhicules de ""transport en commun"" et tracteurs de marque RENAULT VEHICULES INDUSTRIELS"" issue de l'avis dappel public à la concurrence paru au JOUE no 2015/S 214-390952 le 05/11/2015 et son rectificatif 2015/S 245-444743 du 18/12/2015 et au BOAMP no 15-168005 du 04/11/2015 et son rectificatif 15-187315 publié le 15/12/2015 en labsence doffres régulières.Le présent accords-cadres est passé selon la procédure négociée sans publicité ni mise en concurrence préalable suivant larticle 30.2 du décret no2016-360 du 25 mars 2016 relatif aux marchés publics."
16-123704,False,False,False,False,False,True,False,,False,False,,,,False,Le titulaire (constructeur du matériel à soutenir) dispose d'un droit d'exclusivité en ce qui concerne la maintenance.
16-123772,True,False,False,False,False,False,False,,False,False,,,,False,"A la suite d'une première relance le 09/12/2015, un incident de procédure (les candidats au lot 1 n'ont pas tous reçu l'information de la mise à jour de la date limite de remise des offres) a amené le pouvoir adjudicateur à déclarer sans suite le lot par décision du 8 mars 2016. Ce marché a été relancé par voie négociée sans publicité conformément au dernier alinéa de l'article 35-I-1° du code des marchés publics, le 21 mars 2016."
16-123811,False,False,False,False,False,True,False,,False,False,,,,False,"Le prestataire est l'éditeur du logiciel, et dispose d'un droit de protection intellectuelle."
16-123833,False,False,False,False,False,True,False,,False,False,,,,False,La société AMS détient un droit d'exclusivité sur la maintenance des appareils AMS
16-123911,True,False,False,False,False,False,False,,False,False,,,,False,L'offre reçue dans le cadre de l'appel d'offre ouvert a été jugée inacceptable au motif que les crédits budgétaires alloués au marché après évaluation du besoin à satisfaire ne permettent pas au pouvoir adjudicateur de financer cette offre.
16-123957,True,False,False,False,False,False,False,,False,False,,,,False,"le RPA a déclaré infructueux le lot 3 ""Fourniture et livraison d'accessoires et pièces détachées d'origine pour véhicules de ""transport en commun"" de marque IRISBUS"" issue de l'avis dappel public à la concurrence paru au JOUE no 2015/S 214-390952 le 05/11/2015 et son rectificatif 2015/S 245-444743 du 18/12/2015 et au BOAMP no 15-168005 du 04/11/2015 et son rectificatif 15-187315 publié le 15/12/2015 en labsence doffres régulières.Le présent accords-cadres est passé selon la procédure négociée sans publicité ni mise en concurrence préalable suivant larticle 30.2 du décret no2016-360 du 25 mars 2016 relatif aux marchés publics."
16-124116,True,False,False,False,False,False,False,,False,False,,,,False,"La CAO a décidé de déclarer l'offre reçue irrégulière, la procédure de passation infructueuse au sens de l'article 59-III du code des marchés publics et d'autoriser à mettre en oeuvre un marché négocié dans les conditions prévues à l'article 35-I-1° du Code des Marchés Publics."
16-124178,True,False,False,False,False,False,False,,False,False,,,,False,Procédure déclarée infructueuse car aucune offre n'a été reçue.
16-124327,False,False,False,False,False,True,False,,False,False,,,,False,"La société attributaire a fourni un certificat : l'entreprise JCE BIOTECHNOLOGY est fabricante d'isolateurs et distributrice des consommables associés.Les appareils ont été conçus pour fonctionner selon une configuration intégrant ces consommables, validés par la société JCE BIOTECHNOLOGY."
16-124473,False,False,False,False,False,True,False,,False,False,,,,False,Les sociétés Sasp Asul Lyon Volley Ball et Sasp Lbf détiennent des droits exclusifs et sont les uniques vendeurs de places et abonnements achetés en nombre pour assister aux rencontres de leur équipe professionnelle à domicile
16-125230,False,False,False,False,True,False,False,,True,False,,,,False,Le marché a été passé conformément à l'article 32.2.b.i de la directive 2014/24/UE du 26 février2014 et n'est donc pas soumis à publication préalable au JOUE.
16-125752,False,False,False,True,False,False,False,,False,False,,,,False,"Le besoin objectivement justifié de pouvoir disposer de simulateurs identiques à ceux déjà possédés entraîne pour conséquence que des raisons techniques au sens de l'article 30 I 3° du décret 2016-360 du 25 mars 2016 justifient le recours à un marché négocié, article selon lequel 'Les acheteurs peuvent passer un marché public négocié sans publicité ni mise en concurrence préalables (...) lorsque les (...) fournitures (...) ne peuvent être fourni[e]s que par un opérateur économique déterminé, pour des raisons techniques'. En effet, les simulateurs identiques à ceux déjà possédés qu'il est prévu d'acheter ne peuvent être fournis que par un seul opérateur économique, KAVO étant la seule société à pouvoir fournir ces simulateurs sur le territoire français.La présence de simulateurs, qui ne présenteraient pas les mêmes caractéristiques, ni le même mode de fonctionnement, aurait un effet contre-productif et entrainerait des difficultés d'apprentissage pour nos étudiants, en plus d'empêcher d'assurer la continuité pédagogique nécessaire entre la deuxième et la troisième année d'odontologie.Au surplus, passer par un autre fournisseur que KAVO, lequel nous a fourni les simulateurs actuellement utilisés, et avoir potentiellement deux parcs différents de simulateurs comporte des difficultés techniques d'utilisation et d'entretien excessives."
16-126040,True,False,False,False,False,False,False,,False,False,,,,False,"Ces lots ont été déclarés infructueux dans le cadre de l'appel d'offres initial lancé le 4 Novembre 2015.Ils ont été attribués à l'issue de procédure négociée ( en application de l'article 35-Ii-3° du code des marchés publics pour les lots 3, 5 et 9 et en application de l'article 35-I-1°du code des marchés publics pour les lots 2, 4 et 10)"
16-126488,False,False,False,True,False,False,False,,False,False,,,,False,"Le présent marché est passé selon la procédure négociée sans publicité ni mise en concurrence, en application des dispositions de l'article 30-I-3° du décret no2016-360 du 25 mars 2016 relatif aux marchés publics (ci-après, DMP). Il s'inscrit dans la continuité du marché no2011-050M, notifié le 20 août 2012 pour une durée de quatre (4) ans, ayant pour objet des prestations de services juridiques en conseil et représentation en justice en matière de propriété intellectuelle (droit d'auteur, droits voisins, droit des nouvelles technologies), attribué à la société d'avocats DE GAULLE FLEURANCE & ASSOCIÉS au terme d'une procédure adaptée restreinte en application des articles 28 et 30 du Code des marchés publics issu du décret no2006-975 du 1er août 2006.La société d'avocats DE GAULLE FLEURANCE & ASSOCIÉS représente, depuis lors, le Musée du Louvre, en application de ses missions contractuelles, dans le cadre des litiges définis au présent contrat.Ces litiges n'étant pas encoreclos à la date d'expiration du marché no2011-050M, le 19 août 2016, le présent marché a pour objet, de confier au même titulaire l'administration de ceux-ci jusqu'à leur résolution définitive.L'article 1.4 du cahier des clauses particulières du marché initial no2011-050M disposait que les contentieux introduits pendant le délai de validité du marché et non clos à l'échéance dudit marché seront traités jusqu'au terme de l'instance pour laquelle le Cabinet d'avocats a été missionné.Par conséquent, il est nécessaire, pour des raisons techniques tenant notamment à la confidentialité, à la cohérence de la procédure et à l'exclusivité découlant du marché no2011-050M, de confier au même titulaire les prestations de services juridiques afférentes aux litiges non clos, dont ce titulaire avait déjà la charge en vertu du marché initial, et dont les développements n'avaient pas pu être prévus."
16-92967,True,False,False,False,False,False,False,,False,False,,,,False,"Le marché a fait l'objet d'une relance en marché négocié (art 35-I-1 du code des marchés publics - marché négocié sans publicité, suite à appel d'offres infructueux)"
16-94090,False,False,False,False,False,False,False,,False,False,,,,True,"Dans le cadre de l'opération de réhabilitation de la Cité des Electriciens à Bruay-la-Buissière, un marché négocié de maîtrise d'uvre a été lancé, en application des articles 35-I-2 et 74 III du code des marchés publics.Ce marché a été attribué au groupement PROST-AAPP SARL (mandataire) / DU&amp;MA / VILLAR + VERA / STUDIO FORR / VERDI Ingénierie/TECHNICITY, 42 rue des Jeûneurs à Paris (75002), Dans le cadre de la mission scénographie de ce marché de maîtrise d'uvre, les évolutions du programme et des objectifs des contenus, intervenues pendant lexécution du marché, contraignent le prestataire à des recherches et rendus plus poussés que prévu initialement.Or, lachèvement de la conception de la scénographie du site ne peut être assurée sans ces nouvelles prestations, au risque daboutir à lélaboration de cahiers des charges concernant la construction scénographique et muséographique, imprécis, et donc pas de nature à dégager une offre économiquement la plus avantageuse.De plus, ces prestations, qui ne pouvaient être prévues lors du lancement du marché négocié précité, apparaissent nécessaires à la réalisation de la prestation dans les conditions prévues au marché, et  sont imbriquées dans le travail de scénographie dû par le cotraitant DU&amp;MA,En conséquence le groupement PROST-AAPP SARL (mandataire) / DU&amp;MA / VILLAR + VERA / STUDIO FORR / VERDI Ingénierie/TECHNICITY a été consulté en application de l'article 35-II al. 5 du code des marchés publics relatif au marché complémentaire."
