BOAMP_AVIS_NUM,D_14_01_Conditionparticipationsystmequalif_Conditions,D_14_02_Conditionparticipationsystmequalif_Methodeverification
16-117424,Capacité professionnelle et technique,Jusitification par présentation d'un mémoire technique
16-119177,La certification amiante sous-section 3 est obligatoire pour les candidats du lot no1 et du lot no2.,
16-122506,Le dossier de consultation des entreprises est disponible à l'adresse électronique suivante : http:/www.marches-publics.gouv.fr Référence : ISAE-2016-FCS-0058,
16-122970,se référer au Règlement de consultation,
16-123130,"Conformément aux articles R.4412-129 à 132 du Code du Travail, l'entreprise a l'obligation d'être titulaire d'une certification en cours de validité délivrée par un organisme certificateur (AFNOR Certification ou Qualibat), certificat officiel justifiant de sa capacité à réaliser les travaux de désamiantage dont la validité est assurée au minimum 1 an après la réception des travaux.",
