BOAMP_AVIS_NUM,D_14_01_Conditionparticipationsystmequalif_Conditions,D_14_02_Conditionparticipationsystmequalif_Methodeverification
16-80030,voir réglement de consultation,
16-80577,se reporter au règlement de consultation,voir règlement de consultation
16-81024,"Les concurrents joindront impérativement à l'appui de leur offre les certificats et attestations cités aux articles 48, 50 à 54 du Décret relatif aux marchés publics et précisés dans le règlement de la consultation.",
16-81823,Voir DCE,Voir DCE
16-82464,Autres conditions particulières: Entreprise ou groupement spécialisé dans les travaux ayant pour objet la pose de réseaux d'assainissement gravitaire et de distribution d'eau potable sous pression.,
16-82560,"Dossier administratif : -Lettre de candidature et d'habilitation du mandataire par ses cotraitants et attestation sur l'honneur que le candidat ne relève d'aucunes interdictions de soumissionner aux marchés publics (DC 1) ;-Le cas échéant, le jugement de redressement judiciaire,-Déclaration du candidat individuel ou du membre du groupement (DC 2) avec tous les justificatifs relatifs à ses capacités professionnelles, techniques et financièresLes candidats retenus devront fournir les documents exigés à l'article 51 du Décret no2016-360 du 25 mars 2016 prouvant qu'il satisfait à ses obligations fiscales et sociales, sous peine d'exclusion de la consultation.Dossier technique : -La synthèse de présentation du groupement (compétences, moyens et références récentes concernant des opérations de taille et de complexité équivalente selon le modèle joint au DCE (cadre type imposé).-Une sélection des références citées par le ou les architecte(s), illustrées et présentées librement sous format A4, en 4 pages maximum,-Une note succincte (2500 signes espaces compris) présentant l'organisation de l'équipe et ses intentions pour mener à bien le projet.","Critères de sélection des participants au concours :-Compétences et moyens techniques et financiers de l'ensemble des membres de l'équipe et pertinence de la composition de l'équipe,-Adéquation et qualités des références concernant des opérations de nature et/ou de complexité équivalente et d'importance comparable (en surface et en montant financier)."
16-83654,voir DCE,
