BOAMP_AVIS_NUM,D_14_01_Conditionparticipationsystmequalif_Conditions,D_14_02_Conditionparticipationsystmequalif_Methodeverification
16-56065,"Les candidatures devront comprendre les éléments suivant : -- Une lettre de candidature identifiant le candidat individuel ou les membres du groupement et son mandataire, accompagnée des déclarations du candidat (imprimés DC1 et DC2) ; -- Les déclarations sur l'honneur pour justifier qu'ils n'entrent dans aucun des cas mentionnés à l'article 8 de l'ordonnance no 2005-649 du 6 juin 2005 ; -- Si les candidats sont en redressement judiciaire, la copie du ou des jugements prononcés ; -- Les déclarations et attestations sur l'honneur du candidat pour justifier que le candidat n'entre dans aucun des cas d'interdiction de soumissionner aux marchés publics et aux accords-cadres mentionnés à l'article 43 des marchés publics ; -- Les déclarations concernant le chiffre d'affaires global réalisé au cours des trois derniers exercices ; -- Une présentation synthétique du candidat individuel ou des membres du groupement (composition, titres d'études, compétences, répartition des tâches, moyens humains) ; -- Une lettre de motivation de 2 pages A4 recto maximum illustrant la motivation du groupement pour le projet ;-Une présentation synthétique du groupement de 2 pages A4 recto maximum illustrant notamment les moyens et compétences avec CV et désignation des chargés de projets de chaque structure mais aussi l'organisation du groupement ;-Un carnet A3 de 15 références de projets en traitement d'espaces publics, de voies et traversée de centre village, de parc urbain de taille et montant équivalent composé de 5 références propres pour le mandataire, 5 références pour le VRD, 5 références pour le reste de l'ensemble de l'équipe, avec pour chaque référence l'obligation de faire apparaitre a minima la maitrise d'ouvrage, le lieu du projet, la nature des prestations, le montant des travaux, la surface de l'aménagement, la date de démarrage et de fin des études et éventuellement la date de réception de l'ouvrage",
16-56825,Etre à jour de leur qualification Qualibat 1552,
16-57786,Se reporter au règlement de consultation,Se reporter au règlement de consultation
16-58012,"Les concurrents joindront impérativement à l'appui de leur offre les certificats et attestations cités aux articles 48, 50 à 54 du Décret no 2016-360 du 25 mars 2016 relatif aux marchés publics et précisés dans le règlement de la consultation.",
16-58395,"-Renseignements concernant la situation propre du prestataire de service, justificatifs quant aux conditions d'accès à la commande publique visés au décret no2016-360 du 25 mars 2016 et renseignements et formalités nécessaires pour l'évaluation de la capacité professionnelle, technique et financière minimale requise : la liste des pièces demandées à l'appui des candidatures est précisée à l'article 4.3.a - Eléments relatifs à la candidature-statut juridique et capacité professionnelle - références requises : voir article 4.3.a - Eléments relatifs à la candidature-capacité économique et financière - références requises : voir article 4.3.a - Eléments relatifs à la candidature -capacité technique - références requises : voir article 4.3.a - Eléments relatifs à la candidaturecontenu dans le règlement de la consultation",
16-60788,Disposer d'une inscription à l'Ordre des Architectes pour l'année 2016,
16-61763,"Si les candidats répondent sous la forme d'un groupement conjoint, le mandataire conjoint sera solidaire de chacun des membres du groupement pour l'ensemble de ses obligations contractuelles le liant au SDIS dans l'exécution du marché.",
16-8100,voir DCE,Voir DCE
